The anchors said it best - hookers are the only honest interactions when it comes to women.,1
"It's amazing how often they resort to trying to solve a problem with sex. It's like get a fucking hobby or learn to communicate, bitch.",0
"So are you saying that martial arts classes tend to have both men and women? Then just don't fight the women, since a man fighting a woman is like a teenager fighting a 5 year old.",0
"1. They’re looking to see if other women want you (social proof) so they don’t seem weird if they want you. 2. If you’re a virgin, lie. Fake it till you make it. The girl who I lost my virginity to thought I had slept with 7 women (LOL).",1
And I call for someone to shove a broom stick up her ass!,4
"Tsk tsk, Greek. Not ALL women. Some of us love men in all their glorious imperfections. Not ALL men love women the way they are....if they are feminazis for instance. ""Absolutes will always get you in trouble"". There's my American wisdom for you. :)",0
"Sounds about right. In my experience, the vast majority of women have extremely poor spending habits.",1
selection bias - plus most women on tinder are there for validation not sex,0
Curves does it for women. I’m sure women would collectively sue for access to the gym if it were a company. We should start a MGTOW gym in people’s garages or a warehouse similar to the “Heman Woman-haterz Club”.,1
I want to make men understand that the way men care for women in a relationship is not the same with women. Men will be better off (be it in a relationship or not) if they keep their interests before anything else.,0
"Can confirm, all women keep a child sized dildo under their bedside table.",0
"Nope, height is everything girls want, they literally cream themselves over it.",0
"People like this should be thrown in jail. Modern society bandies the term of rape around far too often, leading to people being accused of it by women simply because of spite or expediency.",1
feminists want to trap girls until they have no choice but date old jew dykes [USER] [URL],1
"I’ve seen that first hand. My step bitch treated me and my littlest brother (her son) like absolute shit, but my stepbrother (her first) she doted on him. Course, she is a right druggie POS.",1
"You'll have to take your issues up with the women. They see men as genetically different and choose as best they can among them. This is just a base understanding of women, so I have to consider you nothing more than a troll.",0
"Someone should take her head, put it inside the microwave, and slam the door shut until it actually clicks. Then turn it on and walk away.",4
"Wow lady, you have reached the threshold of Bitter Betty Syndrome with this one... [URL]",0
Also at the end he says women are more insecure and we need to capitalize and take advantage of that,4
Wives and girlfriends cheating is violence against the man because they are giving away the resources invested in her wellbeing. Sadly our society denies that men are victims in any way because woke leftists need an enemy to sell security.,3
"And you still just standing around with your non existent cock in your hand saying, that's not right. Kill the mother fuckers back! You feckless pussies.",0
what it's like attempting to argue with the female species part 3:,0
"We're living in an era where you can talk to a girl, and if she is attracted to you, you'll be fucking her within 36 hrs, and if she's not attracted to you, you get arrested.",1
A few years ago I knew a woman who's 14 year old daughter was the neighborhood whore. There wasn't a teen aged boy with a couple of miles that had not had is way with her. She was pregnant by 17 and had her second daughter at 21.,1
"It does go like BUT here is the kicker, men don't want to be in female clubs. FUCK THAT SHIT! Men don't crave the attention from women as much as women crave the attention from men.",0
"Yeah. But its better when those conversations are with a woman you're fucking. But its generally not worth it. Its like a wishing for a unicorn. Great sex, great conversations, and no baggage?! Yeah right...",1
lmfao i didnt even notice that. I saw she/ and my brain immediately classified that person as retarded and ignored the rest...,1
Don't run away like a little [jewish] girl.,0
At least in Doctor Who gender changing Time Lords is a thing. I'm on Doctor 12 and haven't seen the new female doctor yet. Rey is just a fucking pile of feminist horseshit.,1
What did they expect she's an Old Attention whore that never gets attention anymore.... Madonna slammed online for making Aretha Franklin tribute all about her at MTV VMAs ...[URL],1
"The disconnect these modern girls have is borderline comical. ""But we were just ""dating"" lol!"" Reality for a lot of millienial women will sink in when they hit the wall in their mid-30's in a few years here.",0
"Holy shit, I’m reading some shit on your other comments about her having genital warts? You know what, do us all a favor and just cum in this chick already. You clearly haven’t learned shit here.",4
Yeah we had to drop the bomb to save your dipshit punk ass!! Go hide under your mammy's pussy again sissy!!,0
"The pictures at the bottom are hell. You see these dainty lilly white happy families, but under the surface the reality is that the man makes endless sacrifices to keep the family integral while the wife stays at home probably cheating.",1
I would pay to see her Ass Cracker. #nsfw,1
"Maybe it's just me, but Alice sure looks white. Can we kill her, now?",4
"Yup, that's why I don't go to any incel discrods. They are all filled with fakecels and in some cases, femoids. Also, people only get notifications about /u/ mentions if it's in a comment.",1
There is a Huge Fucking difference between a woman being forcibly raped and a woman having sex to advance her career. These women are not heroes. These women are an insult to actual rape victims. Fuck Time,3
"""If women reject me then it is because they are either fucking Chad or Rover.""",0
Just do what women do and scream rape then close the tabs and clear your history. Easy Peasy. Not your fault.,1
"Like us - But we do not want Stuff that is Broken adn Spoiled beyond repar with baggage - A Pu$$ used from to many ""guys"" (in my case - if she is in the double digit count) can only give me STD's and i definitly dont want this shit from a slut.",1
"Futas don't exist, and traps have same requirements as regular femoids.",1
Should have let her get hit. Stupid guy.,4
Lol yeah i saw that...bitch was a fucking whale....and still found saps to fuck her on the regular....fucking eww,1
Keep in mind women tend to under report the amount of sex they have and other negatives. So the real number is probably 80%. 100% if we count the orbiters that every female has in 2018.,1
"“We’re f—ing your grandmother, that’s what we are doing.” ...... [URL]",0
"Nothing surprising, women have no loyalty. They are ""loyal"" to whoevers strongest and preferably most attractive in the moment.",1
"Completely true. Women go batshit insane when they see this because this is their ace card and every woman tries to suppress it. Women don't marry for love, that's always been a giant myth.",1
"Personally i can't be an asshole even i try, but i see all my arrogant or abusive friends getting a lot of girls , so why would they stop being assholes if it works for them , girls love it so they should be responsible of their choices",3
"SV whores [URL] might be an interesting read. Buy her $3k of jewelry, do the business, give her receipt, she returns it less a small restocking fee etc etc.",0
"Imagine thinking of sports as nothing more than a blue collar job and that male and female athletes are ""doing the same job,"" so they deserve the same pay. That's female logic right there.",3
It’s crazy how men are willing to help women in any hardships or struggles but yet they won’t even attempt an effort to do the same,1
"Awww, c'mon. Just be a woman about it and slap an emoticon on there. Bitches love emoticons.",0
"Alright, I get it. We coddle women to no end because they give birth to children yada yada. But why don't we shame the FUCK out of women who do not reproduce, reproduce with horrible men, damage their child or raise them badly (single motherhood)?",3
Tbh a lot of insta thots are already 95% plastic,0
Not mention man licensing. It would be irresponsible for us to let a man buy a woman without a proper license.,1
"Again! Sweden, you are fucked. Gita Nabavi one of the leaders of Sweden’s Feminist Initiative party, is a supporter of increased migration to Sweden and of zero deportations. She obviously hasn't been gang-raped...Yet!",4
"Most women don't even like hanging out with other women, why would they know how to date another woman?",1
See ladies? The sexes aren't equal. We'd kick your asses half asleep unarmed even if you had a sword.,0
And since you're concerned about these parents simply walking away from their responsibilities why the hell do you support women's ability to pass their children off using adoption or legal abandonment? You're just a sexist pig with lipstick,3
Guys it's one thing to preach about thots being bat shit crazed femnazis but no sane mother is going to let their child be attacked.,0
"I recently heard that female happiness has gone down in correlation with the rise of feminism, suggesting that they were happy in more traditional roles... which makes sense. Someone should post a chart on that.",0
"Good work op, fuking whore ""what are you 12"" bet she wasn't used to being spoke to like the slag she is. She prolly wanted to suck you dry after you spoke to her like that 😂",1
"The witless bitch tweeted a one-sentence apology. She didn't even have the grace to address it to the person she maligned, Barron Trump. [USER]",0
"NAWALT? On a MGTOW site? LOL. Riiiight. I will tell you what all women ARE: All women ARE **equally weaponized** to destroy men in divorce and family law court. If she's ""not like that"" she's probably just ""not like that YET.""",1
"There was an experiment where the scientists were introducing the value of the money to monkeys or chimpanzees. Just little shiny discs they could trade for food and things. It didn't take the females long to start selling sex. Well, there you go.",1
MGTOW to me doesn't mean I avoid women. I just avoid their bullshit.,1
Cope. Don't believe what women say but rather what they do. They love virtue signaling that they have evil white oppressors while love being oppressed by the same people. [URL],3
Most importantly not paying helps filter out low quality women looking for a provider.,1
If you were chad she’d be on your cock right now for doing the same exact thing. Let that sink in.,1
Hey you stupid Trump hating cunt...we are not a Democracy..go hang yourself....bitch!!,4
Ok so I need to buy a tractor now to get women. Times have changed.,0
“There is never a reason to hit a woman.” ... Looks like I found one...,4
I never seem to get the tranny porn on my feed but I exclusively use the app and not the website maybe that's why?,0
"Officially, polyamory is a committed, romantic relationship with multiple partners. Basically, it's an official codification of the modern woman's Dual Mating Strategy. Alpha fucks, beta bucks, there's nothing new under the sun.",0
bwhahahahaha... How many girls even know what an iron is these days?,0
How the fuck can a friend cheat on you. I’m starting to think some bitch just cheated on you and broke your heart.,0
"I'm the guy that fucks with Aerospace Engineer brainwashed monkie pieces of shit inbred looking cowardly fucks like you for the last say 7 years straight. It's my past time, bitch. What do you have school boy",0
I think that the issue is she's bitching about others who make more when it was her own choices that made her earn less.,0
I asked his dumbass why he fell for her. She has that gross cow-ring on her nose. Ugly af and he gets sexy bitches.,1
"...and by real women, I mean NOT puddyhat wearing feminists.",1
"This is a cry for help from the female gender. They are blatantly admitting that they cannot make proper life decisions by themselves, and are begging for men to reinstate full patriarchal rule.",3
"Incels: I'd never help a femoid in any way!! Also Incels: That femoid didn't hold the door open for me, but she would have for Chad!! You reap what you sow, assholes.",1
"My mother was a crackwhore who put me on this place as a crackbaby, I will burn her grave if she dies.",0
"Yep! Just muted [USER], a female (apparently) Jew who weeps and screams a lot and ""reports"" everyone it disagrees with. Watch the bitch!",1
"Before I mute you, ""Don MAGA,"" I'd like to kindly invite you to come up out of your basement & fuck your mother. I'm done with her now anywayz.",0
"Lmao, women can't even be loyal to their own gender",1
"If you *tell* her that she's replaceable, then she has to wonder why you feel the need to say that. It stinks of weakness and insecurity. Instead, punish her when she misbehaves. Let the withdrawal of your attention and interest do the talking.",4
This woman has more balls than most people. Respect. [URL],0
fuck those black and mexi women . wear them at your leisure,1
Hilarity. I had sex with a black woman once. It was a bizarre sensation. It occurred to me perhaps this is what prison sex is like: You close your eyes and try to imagine you are having sex with a woman.,1
Ladies.... never get tattoos.,0
Former Fox News hoe Gretchen Carlson is now doing a spin-off show from LIVE*PD on Lifetime channel about women on patrol. How the mighty have fallen. What is Megyn Kelly doing these days?,1
Hang her up and set her on fire,4
Part 2: MeToo will die out in ignominy after fearful shitlib males start to fight back and some of the women are exposed as egregious liars. There will be alien contact. Mueller and his co-conspirators will all be fired.,3
"Please shoot her, she’s also very cringe worthy",4
"but since she's female, her singing will be the lies that lead the enemy to their demise... don't underestimate cunts!",1
"You sure? What quality of woman becomes a waitress? A student, an actress-to-maybe-never-be and a nobody-forever. All she's got is her tips and her tits. In life that's not much. I'm fairly certain you *are* good enough for her.",1
"When you were younger and more attractive, you dated a violent criminal and enjoyed it. That’s why we discuss it. Being a decent guy is a negative if your goal is sex with women you find attractive.",0
"Feminine traits in men can be exploited for gain, comfort, being in control; what kind of sexual benefit (the kind that men are generally interested in) can be gained from an androgynous woman?",1
The say him as an ltr provider so were afraid to seem slutty around him,0
[USER] Exactly... which is why she loved Obama. Well sorry old hag... your time is done. The world is waking up to the truth.,0
Another 2x Anecdotes. Get educated and bring out some actual sources or are you not an empowered female?,0
What a stupid question! NO MAN...would humiliate himself with such a disgusting display for a few dollars...we aren't women.,1
"She should be strung up, no drop. Let her kick and sway until she expires. #unhinged #crazy #AttemptedMurder #felon",4
she gets medical cannibis cause her pussy smells like a dead goat sanz thats why i tell the lot of yous [URL],0
That was my first thought! Dude staring blankly into space during long-winded corporate speech about how everybody's supposed to love the company and be super enthusiastic? His wife must have killed his soul. Only logical explanation.,1
All her friends know divorce attorneys. Roastie,1
No lol women want 8+ but theyll settle for a 5 if thats what you want to be,0
"You displayed ""relationship material"" signals to a cock carousel rider.",1
I believe we should pay directly from the budget women. You know. For their emotional work. This only make sense. They have a ho(e)le.,1
"By the looks of the angry women at the #WomensMarch, they need to march for a few more weeks before they can fit into anything other than stretchy pants. #Trump #MAGA [URL]",1
dis bitch.,0
"Except it's true....crazy white women get into this kwanza crap more than blacks do. LOLOL and by the way, the meme is cool. don't get me wrong. Oh, and Merry Christmas brother.",1
Strange how she is several shades lighter in the painting. The arms look like ape arms. [URL],1
wish i had a nickel for every time a female said something this stupid to me,1
"Lmao dude seriously. But for reals, it's the fucking social media. These girls all look up to the same instagram hoes and tiktok thots so of course they be looking grown af.",0
You leave my LEGO out of this you dizzy cunts.,0
"First and foremost, fire all women.",3
I heard her labia was the original inspiration for Hammer Pants.,1
The fact is what you say isn’t what matters and anyone who says that doesn’t know what they’re talking about. It’s all about attitude. Obviously don’t tell her she’s a dirty cunt but as long as you’re confident and non phased you’re fine.,0
That's the kind of sadistic shit only women can do to their children.,1
"Who cares what women think, really!",1
If you view women as a reproductive mechanism for the human species everything makes sense. Steal resources & pump out babies.,1
"Don't forget that short women are fun sized while short men are munchkins, sweaty inkwell!!!",0
"[URL] Excellent video, neatly showing how women steal from men. Marriage, meritricious law and diamond rings are all jew inventions that transfer wealth from men to women.",1
1 vibrancy point will be equal to 10 IQ points. Disabled black tranny: 82IQ +30 vibrancy points = 112 final score CisHet white female without AIDS: 100IQ -10 + 10 -10 = 90 final score,0
Stupid entitles careless tart not looking where she was going. [URL],1
Make her unemployed anyway.,4
"Actually is a complete cunt, and a broken shell of a man. He was incredibly emotionally abusive to his wife, he is similarly abusive to everyone he knows as well. He admitted this. So no, boogie isn't a good person, sorry. He's a sad, broken asshole.",0
"Sorry, we can’t just believe every rape accusation a woman makes by default. Women like to lie about these things. As in the UVA case. As with mattress girl. As with the Duke lacrosse case.",1
"Brother, what the fuck are you doing even hanging on to this hoe, cut ties and finish it dude. Come on, she is a total bicycle, are you even seriously considering this?",1
"[USER] We will make her life and her supporter's lives a living hell... Aww, who am I kidding? We'll do it either way.",4
Their equivalent is just a woman that can’t land the man that she wants anymore aka feminist. Then they get mad and seek to hurt the bottom 80% of men for her CC riding actions of the past.,1
"I think I captured all of this perfectly with ""trailer park meth mom."" MT [USER] She is starting to get that look some women get in their 40s that is halfway between ""divorcee cruising for her kids' male friends"" and ""tranny.""",1
Fucking female judge convicted a rapist to less punishment than the guidelines prescribed because he was an asylum seeker. And this is why we should not have women in the workplace,3
Be a traditionalist > Hate entitlement mentality > Massa my thot can't afford to get her abortion pills and I don't have any moneyz #TheGreatTriggering,0
Men work on preserving their financial position. Women look on decreasing it to make themselves feel better or to show off.,0
"Can you believe what this fucking bitch won? Maxine Waters wins media award, uses speech to bad-mouth Trump to newspaper publishers: 'I don't like him' this is absolutely clear and convincing evidence of the MEDIA COLLUSION!! [URL]",0
No. The only people who care about what phone you have is immature middle school girls,0
"Political correctness, #socialism and modern #feminism has turned women into stupid indulged whores protected by the state: [URL]",1
Monica Lewinski looks fuckin terrible now Jesus Christ please blank her face out when she is on TV please good God what a disaster that whore is right folks?,1
"lmao, any female who calls herself a bbw needs to be exterminated.",4
"Dude there are no decent girls, they are all sluts. Also the I have a boyfriend is just a classic rejection technique by women. Lastly if you are alpha enough women will fuck you despite having a boyfriend",1
"If all men were Chad, the movement for women's rights would have never existed. This is dangerously based.",1
"This is what ive been saying forever. Its not that theyre fakecel. Womens standards are reslly just that stupidly high. If you dont look like an ig male model, attracting women is a massive uphill battle.",1
[URL] Human Rights Violations by the Mexican Military. And people bitch that the USofA dropped out of the UN Human Rights Commission. Go figure.,0
"Yes, obviously. On old r/foreveralonewomen before it was made private, they had a rule that you are not allowed to ask them out. Femoids are good at nothing, not even at being alone.",1
i think most men that dont have sex realize that there is more to life than obsessing over pussy and labels.,0
"The worst is, this cunt probably can't even see her cunt anymore and hasnt in years. Has no idea what it looks like",1
Notice the difference in the natural waistline of a REAL female as opposed to the build of a male.,0
"Holy fucking shit dude. Fuck this bitch. Seriously. OP, I wish I could say I feel your pain but I don't. All I can say is I hope you pull through it all. I fully believe in karma and it is a bigger bitch than this woman.",1
"That's what stupid gullible women do. I know of one woman who had children with different black men. Another stupid shit who married a muhammedan got beat up. Both are now divorced and living on welfare. But yes, their children are not geniuses.",1
Are you fucking brain damaged or are you just female?,1
"Jeeze, those damn women and their demands to be treated with professional decency. Skanks, I tell you.",0
"What I like to do is send the dick pic from a burner phone and leave her voice messages in a vaguely foreign accent, and then depending on how she reacts I'll either say it was me or destroy the burner phone and deny responsibility if asked.",4
"The woman accusing George H W Bush of ""sexual assault"" is trivializing women who've been raped or molested. It's ridiculous!",3
"I don't thnk he meant it like that, there was some crazy bitch saying veterans and ptsd isn't much of a problem but her ptsd from tweets were worse. i know, it's almost impossible to believe. thank you for your service solider!",0
She should just choke herself. I'd watch that for a dollar!,4
Jimbo? More like Bimbo? Is he one of your princess gang? Ha ha ha.. who gives a shit if he blocked me.. that's what free speech is about.. you'd know it if you ever pulled your head out of your ass and stop whining like a bitch..,0
"I’m like seeing 2 girls right now, thinking of maybe adding another 1 or 2. No I’m not trolling, it’s doable, I need to make sure “they” are not needy haha",0
"Correction: ""Divorce"" (initiated by women) happens **when** women are the gatekeepers of sex. &#x200B; Women don't divorce alphas.",0
I d love to read tomorrow that Susan Collins got raped by a gang of dreamers. That may wake her up. See what others go through. ANy of thse traitors should have to pay for illegals & we should send them to Hawaii &Susan Collins state,4
Y’all mad a female Quasimodo only goes for 6’0 high tier normies. Jfl,1
Patience is virtue little one. Stay away from the old lady cunts and all your problems will be solved. Hehe. You crack me up.,1
Rape is an inextricable part of women's history. Your rape fantasy thinly disguised as sarcasm is testament to that.,0
Countries with women in charge will always fail.,1
"Yeah. That's literally what my problem with him was. That he was a pussy faggot who can't insult people like a man, and posts passive agressive insults like a little bitch. Lmao",0
If I walked up to a woman and told her she is beautiful she would probably call the police or cuss me out,1
"This woman is obese, unhealthy and not attractive. She just happens to be more attractive than most women with her BMI. It's like having a competition between which pile of shit smells and looks better.",1
"And some women fuck for money. It could be a meal, a bauble, bling, or a marriage. Yes, some women are whores.",1
Women are EQUAL. I know this is true because women told me so and women NEVER LIE! So we will treat you bitches as equal and you can just shut the f*** up bitch. #MGTOW,1
"50% women, and 50% F-to-M transies.",0
Did you know women in America are being oppressed? They should read your comment they'd realize how good they have it,3
"There's a belief that when a woman becomes a mom she is granted some mother rights or something that excuses a lot of awful toxic behaviour. ""I'm your MOTHER"" is used frequently when they disrespect or break a boundary.",1
"She may be an attention whore who knows how to get more attention and followers. If your Game is weak, you'll get hurt. If you have any chance consider her ONS worthy and nothing more.",1
"You incels bitch about how terrible and miserable and psychologically-damaging your lives are because you don't have sex, but as soon as a woman has surgery to get *out* of that situation, she's selfish?",0
Drown her in pigs blood!!,4
Barack Obama is a homo! His wife Big Mike has a penis. That's why Obama wears the mom jeans. He's the butt bitch!!!!,0
Men and women can be friends but not in the way a same-gender friendship operates. A friendship between a man and a woman will never be the same as a friendship between two men or between two women. Happy holidays.,0
"When I don't like a girl, who is not 'right' for me: I give her a can of porks and beans, stick an apple in her mouth, and throw her out the door.",4
