"She's using one of those stupid filters To make herself look like a dog... a female dog. IOW, she's making it clear that she really is just a little ""bitch.""",0
"Hey Dick Sweat. Guess what happens to boring, pedantic, self-aggrandizing bitch-titted asshats on #GabFam? They get #muted. For being boring asshats. #ByeFelicia.",0
nothing holier than legal virgin pussy though. roasties are sin filled.,1
"That hag. I kid you not is worth $250,000. [URL]",1
"The worst part is that since kids will grow up with slut moms, they will think it’s normal.",1
"Good times? It sounds like this bitch shat on you repeatedly and unless you have a poop fetish, that doesn’t seem like a very good time to me. Don’t look back there is no such thing as being friends, especially with an adulterer.",0
Women expect ugly men to be orbiting bluepilled cucks and not view them in a sexual way. If an ugly male acts according to his sexual desires he will be hated by the female species.,1
"Yeah otherwise what’s the point? Might as well be friends with her, your on a date to fuck her not to make friends.",1
no. don't respect all. respect is earned. she has earned none. imagine that... the first woman president will be a quota hire who literally fucked her way to the top. lolololo,1
you grab her face and go in on her. Yeah and then you punch her! YAY!,4
Still at it cunt... Careful I'm finding out an awful lot on your little crew...I might look in your direction next...,0
"My theory is she shot her boyfriend because he ""came out"" as a normal person/conservative. She would have killed him, but her pink pussy hat got in the way of her aim.",1
"One of my arch-nemesiseses, Cat Boobs, makes use of her sexuality as a weapon (Something befitting a woman, if you ask me). Gender is totally my thing. They should have raised the kid as Batman. No confusion there.",1
You can't seriously make the argument that there is NEVER a reason to hit a woman anymore.,4
it should be done as the reason to kick her out... common law would hang her....,4
i don't wanna suck any beef curtain flaps 😂,1
And we can't all tell that the thing around her gut is there to hide all the stretch marks and the torn up stomach. No tits too. Betting they're nice and deflated after two kids Love the man hands too I think I'll pass :),1
"u can ask wifey to play, but you have to be a good girl",0
"White knighting got him torched. Hope his burns have taught him something important about female nature. But then again, manginas and simps rarely learn.",0
That's why real women hate 2D women and want them desexualized :),0
I once did myself out of pussy by redpilling a girls friend group on The Handmaids Tale 😂,1
TIL our moms are skanks and hoes. I love this subreddit!,0
"Most Muslim women are so ugly, no man would shag them unless they had a bag over their head. Which pretty much explains the invention of the burqa.",1
"[USER] (2/2) not have husbands to hide behind, but at the end of the day biology still rules and even an independent feminist woman still feels vulnerable without a protector male.",0
"Yes, normal women want to be dominated. Social scientists call it female hypergamy. And it is why women make bad bosses for men, generally speaking.",1
"Feinstein, croak you old hag",0
"you bring in immigrants who do nothing but hate and cause violence,but your own people are supposed to just accept that.hang this traitor witch.",4
"That is completely different. A man is not losing his value by not being exclusive. In fact it's the opposite. The herd animals women are, they will see a man fucking another women as more desirable than if he was single.",0
"No, men know what women seem to not be able to understand, as women don't really know what they want. Stupid fucking normie",0
"I think rape is to men what motherhood is to women. Most women have an innate desire for motherhood. And men, well...",0
"my bet is he is trying to impress some pussy hat with his ""virtue"" enough to let him in her pants.",1
"Lol! What was it that got Howard Stern in such hot water a number of years ago - something he said to describe a female BB team I think? ""A bunch of nappy-headed hoes"" if I remember correctly. Horrible thing to say for sure - but it was funny.",0
I bet that Muslim shit under her eye says rape me I desire it Sad thing is even a Muslim goat fucker won't touch that dike I bet she is a psychologists lol DR my ass,4
"I don't have any siblings, thankfully. If I had a normie/Chad for a sibling, or God forbid, a sister, I don't even want to think of what I'd do.",1
"part TWO: ""Everyone is equal, but minorities and women need a thousand extra laws to protect and cradle them throughout life. Carbon Dioxide is a dangerous toxin that will kill us all and should be banished from the earth.""",3
Recent assaults by tactical teams on prototypes of President Donald Trump’s proposed wall with Mexico indicate their imposing heights should stop border crossers. MAGA Bitches..... [URL],0
Carousel set comes complete with a generous assortment of THOTs and cucks.,1
"Don't get me wrong I do like being a hit taller but it ain't gonna turn a harlot into a housewife. Nothing is gonna turn a harlot (hoe) into a housewife and remember, AWALT.",1
"I love how the girl writing this wanted to fuck other people, but the girl her boyfriend is fucking is the slut. Goddamn, this is too funny.",0
"I t’s a woman who’s self worth will be grossly over inflated. . > harmless? So no, it’s far from harmless. Social media in general and dating apps in particular have ruined the male/female dynamic in the West.",0
"Gotta admit though, if you are out at night getting a good head on, those Lefty women can be quite the easy mark when you got your beer goggles on! :) Getting rid of em the morning can be quite the problem though. lol",1
Not surprised at all. A terrible mother will produce terrible daughters. Both of these daughters are hoes.,1
Fucker was completely serious. My wife thought about bitch slapping him.,0
"Who gives a fuck about her? Kick her out, change the locks, block and ghost. She sounds like a cunt and things will only get worse. Imagine getting her pregnant and having to deal with her and her freeloading parents?",1
"Also look for a girl from a really rich family maybe, when you're young hypergamy works a little differently so if you hook up with a girl that's rich already, you should be ok",0
Dig a me she- B Da.. Fuck your mother.,0
I like to show her my penis within 5 minutes of meeting each other. If she stays then I'm good to go,4
"Just goes to show you, the Liberals hate when Black's have an opinion that differs. Then, a black woman of course, should go suck a dick for her opinion.",1
And people wonder why incels are becoming more of a thing. We live in a world where women rather share and get cheated on by top % guy than to give an average good man a chance,1
"hotter girls have higher bitch shields and shit test more, its called the hot-shit paradox lol",0
Amazing scene. Love how some slut gets them all into this shit. Too bad the next movie put him in cuck mode.,0
"I literally have no standards and will fuck almost any girl. Lots of guys are like me, so it's easy for even below average girls to get laid.",0
This phony bitch Joy Villa is a nasty skank bag! She can take her Scientology & shove it square up her ass! #OnceASkankAlwaysASkank [URL],1
"five? i start thinking i'm needy at/after 3, at which point im like ""this bitch aint ever talkin to me again""",0
I probably wouldn't brag about that because usually when women make those choices they end up either being single moms or knowing the domestic violence hotline number extremely well.,3
Silk and lace Come sit on my face Didn't want to add To the human race So I put it in her ace,1
"I don't agree with you about the USA and Europe, but this cunt is typical of female Reform rabbis.",1
2nd last one ...u think u fuckin a college bitch but she's older than you're mom,0
"Heh, don't worry about it bro. The only sexual activity those fuckers get is oral clean-up duty of the multi-cummed skank pussy of their girlfriend after getting trained by Black Panthers at a BLM rally.",1
meat will be banned Maybe. Feminists are usually vegan cucks. >authoritarianism will rise Think UK and their new misogyny hate speech laws. >Islam will take over They won't. They're women's useful idiots.,1
"Gaems vanguard at GameStop lol... these bitches lash out at the pretty girls too. Bitter ugly chicks gotta work, even pretty ones now.",1
"[URL] Yeah but she's a typical white girl. Thin brows, no lashes, thin lips, but also with bad skin. All of my white friends look pretty... tired without makeup.",1
"What the hell, Sergei, I'll take a daughter like that any day over one that's been to University and came back with pierced nipples, pink hair, and SJW slogans painted all over her bare breasts! It pretty much looks like normal Girl Stuff to me...",1
"Disgusting and sad. I know women who had abortions and then were never able to have the children they later wanted. Sad, empty lives.",1
/u/GallowBoob must be just drowning in pussy,0
Specially if they are young. Young women may well not have the maturation to see beyond the surface.,0
"Amen, imagine trying to discuss or the options of a race of woman when you don’t even make a blip on their radar. Chad, Tyrone, etc. all fuck big booty sexy black bitches op cope",0
"Okay bitch. Go ahead and trot out some women who cook meals and wash clothes, I’ll wait. *sets sundial*",0
For some reason fat women can have fun with chad. Fat me don’t have super chiseled platforms for the roasties to play on. Chad still has fun. Female gets a roused from the fancy things fat man has. It’s so simple but it hurts so much,0
"I always thought prostitutes were real women, damn I didn't know they were just sex robots!",1
"Yet, they will allow a dyke gym teacher into their 12 year old daughters locker room or allow them to adopt a daughter and help her with her first training bra, wonder why the world is screwed up !",1
"AWALT always applies. See how long she'll stick around if he never works and decides to just sit around the house, even if he cooks and cleans. And start spending her money.",1
"dread game is going to make many women shut down emotionally and physically. Not in my experience ymmv but ime lots of women respond VERY strongly to it, it makes them fight for you and even go a little crazy trying to secure your commitment",3
Demanding money for sex = whore &#x200B; Tbh hes good looking too. If anything she should be paying him...,0
"its the other way around -she,' his white trash HO,",1
"They need to throw her under the prison, disgusting and vile woman.",4
Incels being attracted to children: just natural biology. Incels repulsing women because of… shortness or something: FOIDS ARE SLAVEEEEEES TO BIOLOGY! THEY CAN’T BREAK THEIR ADDICTION TO CHAD COCK!,1
"Time for citizen's arrest. If Law Enforcement won't do their job, it's up to us. I'd love to see someone cuff that bitch at her next Costco book signing event",0
"But I thought women could instantly detect sexism, creepiness and bad personalities. Oh wait, I meant attractiveness",0
"I have no idea where you see me complaining. Men still have higher labor force participation and are more productive in the workplace, so surely by your logic you should be working to make women shape up first.",3
"No matter. All it takes is a female co worker to say “I feel threatened, he said GUN!” No proof req. you will be ordered to turn in your gun within 48 hrs.",3
"She knows she's not good enough for more of your time and is blaming you for it. Ditch her asap, she'll only get more clingy and mood swingy.",1
I tipped your mom a fiver for Mother's Day. She sucks almost as hard as you.,0
Every woman is a whore when you are an incel.,1
LOL that fat girl .... black men cant catch up to us so they are angry ..... sooo black men are angry because they are not marrying black women .... LOL bitch plz,0
Only thing uglier than that woman's face is her spirit. Only thing lower than her IQ is her immorality.,1
How great is this pic of Duterte with some of his troops? I usually am not in favor of female soldiers but I may make an exception here,0
Nah but your mum's pussy tastes mighty good,0
Bitch waited for her Christmas gifts first 🤛🏼 you gon die,4
Surprised Sheila Jackson Lee can keep a fried chicken leg out of her mouth long enough to show up in front of cameras and talk. She’s a greasy ass nappy ho.,1
"I love the former first lady. She is a brilliant person, woman, beautiful, and not a ghetto bitch. Learn the difference. In fact, I like her more than I like BO. Beautiful family though on all aspects.",1
"How do u spell cunt? This woman is a traitor, she needs to hang",4
I call it ugly women attacking good-looking white women. It's all about envy and bagging yourself a Chad.,0
"Women *do not* help women. Wherever there is a woman success story, there is a man or men who bankroll it. And it used to work. But the problem, these days, is that the women have begun to *resent* this bankrolling.",0
"If you find a weaker female candidate is promoted in preference to yourself, I would resign immediately. So should every male.",3
"I don't see why they even bothered, nobody said cellulite wasn't natural, just that it isn't attractive at all. Oh boo hoo women have to deal with having a flawed appearance, cry me a river.",0
and if he makes less than her...he is a loser dead beat husband...yet men never shamed women in the past for making 0$...,0
At least you have a decent penis. Some girls will reject you based on size alone.,0
"I don't understand how white women can hate other white women so much. How does this support POC like they say shit like this is for. Hate is Hate, color has nothing to do with it.",0
It’s different if you’re a woman. Spreading your legs just gives you sex,0
"A fleshlight costs $80, doesn't demand more money and will never accuse you of ""sexual assault."" Win/win/win",1
"Soooooo, Comey has decided to reopen the Clintongate case. I guess he got his ASS handed to him after letting the bitch go free. Let's hope he does his fucking job this time and puts her in prison where she belongs!!!!!!",0
"The people they interviewed are already playing the "" pity her , she is a woman , it's all the evil man's fault card . "" She is Hollyweird and pretty so she will get a slap on the wrist as usual and walk .",3
"She let you do anal, that's how they keep you. But seriously, Think if you did marry her, you got off easy.",0
Is she a porn star? If she is I want to see that ass.,1
celen dion is the wicked witch of the yeast,1
"Imagine being pansexual polyamorous. Well, seems I'm a slut. Ethical Slut.",0
"Instead of letting foolish women demand all of our attention, we need to pay attention to this. A fellow veteran.",1
dumb ass women today ask more why you are not divorced and collecting huge alimony checks,1
The righteous indignation from the white cunt on the left is disgusting. Watch her face throughout the video,1
so you dont know shit just like most women running that fuking mouth,1
"In my experience, women do not want equality in a relationship. The problem is they think they do for whatever reason so you gotta deal with nonsense like ‘pay for me’ as well as ‘we need to be equal’.",1
How bout we feed her tongue to the pigs first,4
"CRAZY BIMBO IS BACK! White Uncle Tom: Rachel Dolezal says she's ""Trans-Black."" Ugh, this dumb bitch! I thought society was through with her! [URL]",1
"wanting a real women is not ""hatred"" or trans. its just we dont give a fuck about dating people with penises or people who had penises.",1
"My favourite was when a woman considered leaving her husband because he was infertile, she was not the asshole. When a man, however, considered leaving his wife because she's infertile, he was the asshole. Clown subreddit.",0
"[USER] ya, that's why she's a whore",1
"I kill all of my bitches before fucking them. PUSH-PULL, what up?",4
You tell her yeah this is crazy I can’t believe it or some shit... it’s just she doesn’t want to feel like a slut. However next time let her touch you first act like u don’t care.,0
Typical praising of women and bashing of men. They're so predictable. And dumb.,0
Daily reminder that nobody seriously thinks like that. Daily reminder that this is just payback to women for mocking us for our height and penis size.,0
It isn't external validation. I am happy because flοoded her mouth with my juices. It is my cock validation!,1
Real solution is to get a girlfriend [and take her to fuck clubs]([URL] which combines the best aspects of free sex with the novelty of new gash. Win-win all around.,0
I am Canadian and I'm kinda disappointed that we won't get to see your great President bitch slap Trudeau any longer.,0
Says the guy who is by product of shitskin mother having un protected sex with a nigger.,0
That evil woman deserves to be executed by hydrogen bomb.,4
"""Muh poor oppressed women"" What is this retarded faggot shit?",3
Physically gifted. The strength of a woman doesn't even come close to that of a man's. Read something about how the USA women's hockey team was butchered by some amateur teenage men's team.,0
"It's not his job to keep other guys away, it's her fucking job, and if she doesn't respect that he gotta get the fuck out. A billion pussy in the sea",1
Im not black but i’m short asf so i can agree that women are indeed shallow.,1
"I think I would smash a guy before ""her"" :lol:",1
"The return of male only spaces is paramount and tricky but can be achieved; barber shops, cigar parlors, gun ranges, hunting lodges, motorcycle clubs, dojos and gyms. Also, a competent replacement for the Boy Scouts would go a long way.",3
This is a place FOR THE LULZ! The only time women come up is when we are MAKING FUN OF THEM!,1
"When you try to prove women can be strong too, but accidentally become a bald, obese, transgender abomination. KEK",1
"Ya, The smiling Charlie Manson looking bitch will smile in your face as she sticks the knife in and twists",0
How to cut the life expenctancy of your son by 60%: Call him daughter.,0
"I hate to say it but [USER]'s right, stop it right there [USER], [USER]‍ sent her nudes to half the site and then complained that her nudes were floating around. Stupid cunt. EDIT: By the way [USER], send nudes. Pl0x. ; ~ ;",1
"Did she rape any underage boys? If so, guillotine her.",4
"I'm a hobbyist photographer and tbh it's hard to focus on foids when you are shooting, you just want the bitch to understand instructions",1
Online dating culture. Any 5/10 girl and above would get the 99+ likes notification within a day of joining tinder. Gives them automatic abundance to spin plates. Plus feminism encourages them to sample as many dicks due to sexual liberation.,0
they do... some can handle rejection by inventing a false rape story or worse. Some will just scream a man has a small dick if he doesn't want her.,1
"Bro looks don't matter, I'm sure if we just shower and work out we will turn into white male models too!! Not that women seek these type of men of course",0
"I wonder if Muslim women who wear the burka look at nuns and think, ""Look at those slags with their noses hanging out.""",0
"Whenever I overhear a woman on the phone, I lose all faith in humanity. It's never an /adult/ conversation. Just drama, and only the kind of drama that absolute degenerates get themselves into.",1
"That bitch is stupid and dangerous. She’s a parasite, she only knows death and destruction",1
"See a therapist. But make sure it's not female, or one that goes ""You just haven't found the right person yet.""",0
"LOOOOOL r/ChildSupport I haven't opened that sub yet, but it seems to be a cancer sub of single mother sluts. Worth a read perhaps if I want a laugh and sternly remind myself to go MGTOW and ignore these bitches.",0
"because you're trying to be nice jokes aside,they're insecure thats why they're trying to be rude,showing that they can reject anyone,just like attractive girls",1
"The arrogance of these people is never ending! They think they are gods, disconnected from any possible consequences of their actions. I suggest that Titans fans should take this bitch up on her offer and not show up in droves.",1
.....im wiggapriveledge yo git ti fuck oota here yo niggapriveledge muthafuck ya on ma turf ya all pay me ho.,0
"In many ways, women are like kids (or dogs). You have to set boundaries early. They might test the boundaries on occasion. But once boundaries are set, they're easy to reinforce with authority.",1
so cute when a washed up WHORE finds the cuck of her dreams [USER]‍,1
probably from 4 different dudes too. You have to be a fucking pathetic cuck to get into anything with a single mother.,1
What's it like being a Pagan bitch..educate me cunt face!,0
“BELIEVE THE WOMAN:” America always knew woman’s Emmett Till story was a lie. After more than a … [URL] Democrat women have lied about sexual assault for a long time.,1
"Challenge her ego and If she gives you attitude don't stand for it. Obviously know your limits, don't be an asshole, but she is probably used to digging her heels into men. So if you be firm like concrete she'll jump.",1
"Just do some wannabee porn with Crack whores, funniest thing ever",0
Oh for a woman who can cook! It's why I married Lorraine but she went to work at Mc Donald's and absolutely refused to cook for me. Go the Hell Cunt!Otherwise I forgive her.,1
Wish the Jews would kill her.,4
"Woman hits a man? Hit her back With equal rights, come equal lefts.",4
"Yup, when I was a kid, my father once told me ""if your bitch can't cook, she's not for the long run.""",1
"Yeah validation is what drives their every decision. It’s the same kind of feeling a man gets when he is needed and has the skills to help. Except women have no skills, they are just a wet hole. So, no validation no reason to exist they breakdown.",1
"Uhh... You look like a gorgeous Chad but you smile like a little insecure bitch instead of smirking, so women that were attracted to your toned bod and dashing good looks become immediately turned off. Maybe don't do that.",0
Chad is rawdogging her in the all gender bathroom,1
"Isn't the IQ the same, but the variation is higher? Resulting in less stupid women, but less smart ones as well?",0
"Interesting. Even more reason to lose weight if you're an obese woman. The average woman is so fat nowadays that shes almost at the ""ineffective range."" The **average woman.**",1
"You're in /r/pussypassdenied . If a woman isn't looking pretty and/or being subservient to a man, then they're a radical feminist that deserves to die alone and unloved.",1
Eat shit faggot. #TurdReich #NeetSoc #BloodSoilTendies He uses your friend's money to pay for motels to eat his wife's Mexican pussy. [USER],1
"These are accomplished women of domesticated finance. They have a talent for recognizing lucrative marriage investments, and the ability to maximize the return on their feigned interest.",1
I think feminism is just female nature on a societal scale: Individual men fighting over a woman are replaced by men of different countries fighting against each other. But the outcome is the same: they will mate with the winner.,1
U must have quite the gift of gab to do p4p without it coming back to kick ur marriage in the nuts(like blackmail or false rape charge) Good for u. Wut age range are the females who u get with since ur wife refuses to meet ur needs?,1
"Look at me, I can afford thots on my beta orbiter's money. Living the dream.",0
"She's a fucking Liberal and a progressive one at that. She sucks two teats, her wife's & the Globalist's.",1
When will that old cunt die already???,0
women are the worst judges of character,1
"single moms + the state = don't need no wheat bitch. let them rot with their miserable life, could care less.",1
I hope the twisted old hag doesn't haul her bony arse anywhere near our team.,1
1. Basically she looks like shit without makeup 2. Karma is a bitch. Bigger bitch than Cardi !,0
#TheView is trying to keep professional slut #StormyDaniels and her sidekick attorney relevant by having them on The View. And on a segment called “The Political View” nonetheless 😂,1
Black women might be the biggest thots. Generational experiences.,1
"How about: ""The unworthy non-victims of non-rape"" Hell, let's just go completely feminist-approved. ""The Unworthy"".",1
[[URL] Smart women **do not** choose weak men.,0
"Fake News media whore.... politicized and sensationalized tragedy, instrumentalized grieving victims, all to prop up ratings (perhaps her 401-k, also) for a sinking, sinking, failing, lying network...She is a A despicable, deranged pos",0
What do you disagree with? If a guy is being an obnoxious cunt who is making women feel uncomfortable he's hurting the club owners business. I don't see anything wrong with this.,0
Ya'know... got the feeeeeeeeeeeelings all hurt..... gotta monitor our tone and all to please the stuck up little bonnie lass so she doesn't have herself a tizzy,0
"this bitch was giving him guff in the movie.. I was pissed off, women end up ruining black boxers careers.",1
Every day this traitorous and detested woman harms Great Britain and damages her party. She is the most complete failure as a PM one can possibly imagine. Only the deep state keeps her in power: [URL],1
How did she get two queens??! How did the castle and bishop become king and queen? Why is one of the black pawns behind the front line? This bitch be dummmm,1
"""The simple answer - it's complicated."" The simple answer - women are paid less than men because they do different things than men.",3
