"I don't cancel netflix because of this shit, but when they stop producing what I watch, I will. When it comes to specials for this bitch and her ilk, I simply do what everyone who doesn't like should do, not watch.",0
I'm not. I'm speaking to women who may fall for the feminazi bullshit. ;-),3
That's what happens little girl when you mix cocaine and milkshakes together. ;),0
women cant handle security/guard dogs they are pack animals that respond to male alphas,1
Tell the friend to dump the bitch. Let him watch how easily she gets another man to simp for her.,1
You aren't supposed to hit women no matter WHAT they do.-Says some dumbass Simp. I wish the officer could have beat her with a club.,4
"Computers can already reproduce shitty modern ""art"" [URL] Next you'll tell me AI can burn toast and park like a woman.",0
wow now abc becomes self aware and realize that firing roseanne was a huge fucking mistake grats abc you are going to get killed in ratings and all of her fans told you so way before hand you dumb cunts,0
"I agent met a single woman who actually cleans up after themselves. Go to a chicks house and there is more clothes on the floor than floor showing, filthy bathrooms, with makeup and shit everywhere and sinks full of dishes No shame at all.",1
"[USER] please, god, put this feral bitch down before she influences anyone else to go down her disgusting cat lady path",1
"I can vouch that 3% man is solid, esp to break your inner bitch. It’s got dozens of great lessons that are sure to improve your odds. Lots of pickup advice, but the true power is in honing in on your inner game Edit: Sinek is the man as well",0
"#BadBitches #MeToo "" the women’s penitentiaries are full of bad bitches… so therefore let America celebrate incarceration and sadism!"" [URL]",1
He's probably ashamed of her. I would be too. Tbh if I spawned a feminist I'd hang myself.,1
‘It’s part of her body’: Trans activist tells straight guys to start dating trans women [URL] via [USER] I'm sorry if it doesn't have a pussy it's not a woman!,1
"It's the advanced version of the ""let's take a break"" ploy - keep the beta on the hook while ms. hamster tries to lock in a better prospect.",1
Alot of guys will still bang the ugly girl. Girls are not like that in my experience because sex is abit different for them.,0
"The pink pussy hat brigade exposed as clueless [URL] and increasingly, other women are publicly disagreeing with the idiocy of these clueless twits [URL]",1
The guy was mobbed. I hope they drop the charges. Obviously only reason they cuffed him is cause it's a young girl. This is great though. Girl winds up her shitty little swing and then...BOOM...,3
"considering how men's issues are treated, the building would more accurately be 1/10 the size of the women's one.",3
Accountability is Women's kryptonite. I have seen it over and over and over. They will never sincerely apologize or admit fault. She is not sorry that she cheated... She is sorry that she got caught.,1
I basically have. As much as a woman could be politically aware IDK. But she understands (((WHO))) is doing the degeneracy-pushing.,1
They just need to be bitch slapped by a real woman.,0
"Why do you disbelieve God was unnecessary for your creation? Granted, your mom should have swallowed your Dad's load the night of your conception.",0
[USER] Lol Stop being her bitch. She lost get over it!,0
And yet Hillary allowed her maid to print out TOP SECRET INFORMATION and her daughter to see it also! She should be executed ASAP!,4
"What is there to think about? Kill her, kill the friend, dump them into the Atlantic Ocean with cement. Just kidding. DUMP. THAT. BITCH. Hopefully, more men are starting to wake up and go their own way.",4
"Imagine you bust a gut for 25 years and don't have to work anymore. If you're married and spent an afternoon drinking scotch and playing video games, your wife will subconsciously think you're a lazy loser and be a nagging bitch. No thanks.",0
Fake it till you make it. For all she knows you're already drowning in sluts.,0
Because she's a skank.,0
"courage precludes the wise and strong from prostrating to his base emotions. let the woman freak out. were cooler under pressure, so lets be cool under pressure. let the women attack us physically, were stronger. being punched by a woman is a joke.",0
"dont take medication, it will fuck you up. if you need advice, ask men, don't listen to women. most of all: read and study. knowledge is power.",1
"Thing is you will be used by the system regardless of you pay taxes it will go to worthless single mothers and there’s nothing we can do about it, it’s just like female nature it is what it is",1
And if we said ‘women are trash’ it’s a completely different story..,3
"If it happens, it will be the final nail in the coffin of any kind of real equality, when women's bodies literally become for sale. Well, incels would agree with you there, that a sex robot is indistinguishable form a real woman.",1
"I have been to therapy, it's a load of shit. I wouldn't help a female because they don't deserve it. You were saying that I decide to be a virgin for not helping a female. The rope is definitely the answer given the way how females are.",1
The cunt shit in her own nest...now she's in hiding!,0
"Lol I wonder what you'd say if he got divorce raped a SECOND time. ""At least he got laid bru. He'll probably find third woman to keep sucking him dry while you're wasting your time posting here bru""",1
You sound like a big fucking pussy. You think “we” should have boundaries??? Fuck her and fuck you. You don’t need her permission to set boundaries. What exactly did she say?,0
[URL] So she's a Whore - what a 😨 shock,0
"whats trm? and anyways they're high tier beckies. cant be stacylite with those faces, regardless of their body.",0
"I don’t care whether you like the post. Furthermore, there are always going to be outliers to any social trend. The overwhelming majority of college girls, however, act like shallow entitled bitches.",1
I cope with it like I'm imagining punching her in the face.,4
"bUuTttt....mEn aRe rApiSts aNd sExisTs anD wOmeN aRe liTeraLly aNgeLs. yOu mIsogIniStic,wOmeN hAtEr",0
"Even femcels+the hambeats on IT admitt that they could easily get sex if they wanted. Theres nothing you have to do to get sex as female. You dont even have to be female, even transwomen are enough in 2k18",0
Forget the daughter. She'll just grow up to be a slut. Now if it was a son I'd say fight for custody,1
This bitch is nasty... she would likely try to talk as she is forced to give head...fired after the first blowjob.,4
"Dress up as Santa Claus this #Halloween .... Invite hot women to sit on your lap. Have a sign that you point to when ugly women try to sit on your lap... ""Sorry. NO SJWs.""",4
If it's reciprocal then it's fine... But women are just not like that so don't cuck for these thots.,0
"She could, you know, actually help him if he's shy. Instead of constructing some bullshit hoops for him to jump through that he simply doesn't understand. But I guess that would be like a guy helping a fat/ugly girl.",0
All women are inherently untrustworthy. Some women are fat. Therefore fat women are inherently untrustworthy.,1
"Whether its a fat fucking bitch in the Hollywood Hills or a shy cute feminine Japanese girl. Once she is bored, finds another guy more interesting or you lose frame, it all goes to shit fast",1
again is opposite those 20% of men don't compete each other. 78% of women compete each other fro 20% of men.,0
"I look at the bright meaning of the picture, Trump replaced most powerful whore on the planet, now he took her place and He in charge",1
Stuck out her tongue??? What a whore,1
girls have cooties,1
"My bad, should've stuck with comments about your mom. Some guys are just beyond help.",0
Lol beta bux I've come to realize that most women hate MENAcels and currycels the most,1
Of course they fail to mention that the majority of women are given high-paying jobs where they do no real work because they have vagina.,3
"Im not a whore and always was proud of the fact that I am modest. But, you're a little pussy who needs her tampon changed!",1
"So it's' ""ownership"" when a man wants custody but not when a woman assumes she's entitled to it. Patricia Ballasalma, go die in a fire.",4
"I wish that AntiFa woman had gotten hit too....women who are sluts and whores and work for the other side should get ""equality."" They get treated like men...maybe worse....",4
"Go back to treating her like the dirty whore she is. Being serious. Stop buying her shit, start fucking her like you hate her.",1
"There should be NO brown/black judges, or women judges.",3
I love this because the liberal programming is backfiring. Nosw you have all of these harpies going caw rape caw caw rape.,1
It’s just youth a. K. A. Fertility that makes most women attractive. That and symmetry as well as blue or green eyes. The eyes because it’s an indication of being your offspring.,0
"I agree. I'm a 4 or 5/10. I fucking hate my life, and I'm starting to get a hatred towards women.",1
noodlefoids are the biggest white supremacists. They claim anime aren't designed to look like white people but it's fucking obvious.,1
"I don't understand your problem. Most people here hate that they are attracted to women, once they know their nature. I envy you.",1
Now how about a picture of her with the club That She Would Have Killed Our Border Patrol Agent With .. F__k the bitch ! [URL],1
It’s a control thing women are trying to have over you.,1
"The hotter the woman, the hotter the hellfire..",0
You've seduced a girl before right? Just do the same thing with her without the kissing. Pull ya dick out and make er suck for god sakes,4
[URL] So her main competitor is someone who lost against a pussy socialist. The mainstream has no clue. Le Pen is quite left wing on issues of welfare so will still get alot of Hollande's vote. #MFGA,0
Fuck that cunt. She's in hell alright. Ill pray she's suffering for eternity.,1
It probably wanted to suicide but was too much of a pussy.,0
So whores > queens. Mmmmmmmmmmmmk.,0
Always make her something first and see how grateful she is I bet you she'll through a bitch fit for not spending 100s of cash on her.,1
"Love how women are so ready to call any male they find unattractive ""creepy"", but an older woman fucking (and in cases like this, rape) a young dude is FAR more frequent than the other way around. If anyone is creepy, it's women.",1
"Not trolling, it's scientifically proven that men are stronger than women rape is about power women have no power over men, men wont rape other men, since they prefer women of course.",0
most guys are fools they don't know when to next a bitch,1
"What normalisation? This fucking witch needs to be thrown in a river and burnt if she floats. It's no more than a pedophile cover-uppererer by day, pedophile normalisation salesperson by night. Fucking sick! And the sick sheep watching all clap!",4
Face only. Woman will fuck a chad in ripped oily jeans and a stained wife beater.,1
"You don’t delete on gab my friend. Unless it’s left wingers, you can delete as many of those cunts as you wish.",0
Everyone knows what the Niggers in the movie wanted to do to Julianne Hough. Smoking-hot bitch. But of course... she's White.,1
No divorced woman is family oriented.,0
"See, you get it. Happy wife = happy life unless she is a gator as referenced in an earlier post. When she least expects it, give her a little peck on the cheek and then jump outa the way.",1
"It also seems like somehow women showing skin, wearing regular clothes, and wearing burqas all oppress women.",0
Shameful that women like this make it almost impossible for real rape victims to get justice. She should stay locked up.,1
"I love how you tried to frame is as playing devil's advocate when it's really what you believe. Actually I believe exterminating Muslims and Jews entirely. We should start with their women, to disable their reproductive capacity first.",4
"Yes, because she made a mistake,she SHOULD pay for it. It was her mistake not society's. I'm all for legit help for someone in need but people who fuck around, don't use protection and then expect to get bailed out can go screw",3
"While I do agree with ""Stop Asian Hate"", it is hilarious watching Asian women trying to look woke doing it while many of them are literally bragging about being the ""colonizer's whore"".",1
"Willie Nelson Mamas, Don't Let Your Babies Grow Up To Be Cuntboys (This one has a lot of real world value in the age of feminist men)",0
Ive spent time in Sydney. They have legal prostitution there so the women have to be slightly less cunty to compete with the professionals. Its better than the west.,1
Trans women will make female sports great for once.,1
"What a joke, she really needs her meds now, women can’t face reality",1
This unholy seditious cunt bitch is going too far [URL],0
Feminism Lite (1950s)ain't happening either. Don't wait! Hit your woman today!,4
"LMFAO! WTF is that supposed to mean you crazy cunt? Is that something people do in Mississippi, lick bedpans? Take another narco you stupid twat.",0
Nothing can change the dating market imbalance anymore. Nothing can change female hypergamy anymore. It’s over dude. Your political affiliation is beyond meaningless.,0
Lol. My therapist is an attractive young and sweet lady. I won’t be ghosting her anytime soon,0
"They aren't. They never will be. All this taken advantage of theory implies they were ever good. Look through history, they always collapse societies. It's not triple bracket crap, it's just what women do.",1
"God damnit! Put this bitch on blast! Seriously, fuck her.",1
Is it supposed to be charming that she is always hungry? Spoiled women are so odd.,0
"Very occasionally a feminazi is just too pretty to really make a great attempt at looking like a trained monkey. Once she does a few rounds of the cock carousel and the hygiene starts to go, doesn't last long.",1
"And there we have the root cause of the ""white male problem""... white women are to blame",0
"Correction, men chase all types of women but most are just for sex.",1
"Swedish Man Hater's Club Meeting: Angry, bitter women are welcome to attend. Free donuts if you're fat and generally ugly. Attractive women will be shunned. [URL]",1
I wish we lived in a fantasy world where women actually valued things other than getting their curtains wet.,1
"Women who has had many sexual partners: dirty slut who rides the cock carousel, how dare she? Men who sleep around: dominant alpha male guys other men put on a pedestal and try to emulate",1
"[URL] This whore is off the charts crazy, she needs to either overdose, or stop taking whatever she's on. Colbert is a liberal enabler who would gladly watch her implode in front of him for ratings.",4
and he's probably in Europe somewhere slapping and grabbing puss. He doesn't know it's illegal. ha,0
What a fucking sore loser! Hillary Clinton is still blaming everyone but herself on losing the 2016 Presidential Election. #HillaryClintonIsABitch,1
trump deserves being called an idiot to some degree you are literally worshiping him like a god and on a side note i hope you know any race but your little white race will beat the shit out of you irl bitch,0
"Granny, just answer the question, please. I am sure it triggers women a lot since they are self-conscious about their weight much more than about their N count lol",0
"Are your chromosomes XX? If so, you're 100% female.",0
"""I love my husband very much, but I made the conscious choice to have another man's baby."" Astounding audacity to claim she loves him. No, bitch, if you did that to him, you don't love him. You love exploiting him.",0
"There is a meme of Blacks asking, ""Where the White women at?"" No White guy ever asked, ""Where are the Black women at?"" They're fucking ugly.",1
And she will never put 2 and 2 together to realize that her fatness is causing the diabet-us. And the beta bitch doctors won't tell her because he/she doesn't want to hurt her fweelings.,0
Just another greedy America hating Jewish cunt,0
You can also stay single. I’m just stating the harsh reality that western women dont cook or clean and rob you for eveything in divorce. They think they are hot shit but in reality they are lower on the totem poll for me than a dishwasher in China.,1
"[USER] I may be in the minority but I get a kick out of the female form, even dressed like that. Provided, of course, that there's nothing extra visible and hanging over :)",0
My God what a dumb bitch,1
"Yup. If a girl turns you down for the 8th grade formal, then she deserves to be brutally raped. That's what it boils down to.",3
What do you call it when a woman can falsely accuse a man of sexual assault and he is immediately presumed guilty until proven innocent? #femaleprivilege,3
The gov't forcibly giving mens money to women is a primary source of social breakdown. Women no longer need to act positive ways for society to gain its material benefits,3
"Hahaha, what a cuckold. I would've just ghosted her. ""I will not tell her what to do"" YOU ARE IN A RELATIONSHIP WITH HER, ITS YOUR DUTY TO TELL HER WHAT TO DO. Cuckold motherfucker. Now it's too late, dump the bitch.",1
"Gotta keep them beta cuck orbiters in line right? Todays women, a joke. The best you can get is a really wet pussy but that shit will dry out eventually.",1
"The average female body these days is heavily over-weight, the way shit is going, a thin 5 will become a 9 just by the virtue of not being over-weight in the next few years.",1
"HEY MORON! FUCKING MORON! Men go to such stores in order to get supplies to GET WORK DONE. Why bother telling women this, they don't have a working theory of mind and can only project.",1
Thanks feminism for showing real female nature openly. Thank you for making MGTOW the unstoppable force it is.,0
"I would just start fucking her!! What's your problem, bro? You don't ask, you just do it!! In my 42 years on this earth I've never had a female that wasn't a relative sleep over at my crib/pad and not give me some pussy!! You are simping big time!!",4
Ha good point. Forget physical differences if he decked her I would say bitch had it coming!,4
"That hog-faced hag has now been ""chancellor"" of ""Germany"" longer than the Fuhrer was. Don't they have some law about term limits?",1
I live in NoVa too. The women here have no idea how good they have it into regards to the male dating pool. And yet all of them still bitch and complain about the men they see,0
She'd be drinking that bleach if she ever pulled that on me.,4
"Nasty whore was probably raised by a race traitor, whore, mother.",1
Please. Whip out your white chad jawline and your fat cock and she will RUVYOURONTINE!! Asian bitches is the same.,1
Providing Emotional Support is gay. The best way to pull anyone women included out of depression is squats and nutritious food. You should be leading your girlfriend not being her vagina boy. She already has a vagina she doesn't need a second.,0
Girls are weird they secretly take your pictures and do all kinds of weird things but only other girls know about it usually,1
"Women of an earlier decade were taught about proper ""consent"". [URL] The problem with women is they want the hookup culture to seek Alphas, bu want the puriticanal prudery otherwise.",1
I think he was trying to get to the bottom of her hypocrisy with his questions rather than our right attack her for her violent behaviour... She's a nasty bitch so he knew he had to play it carefully,1
How do block people from following me? A bunch of nasty women are following me on gab.i'm disgusted!!,1
"Ladies... kitchen sandwich,learn it,like it,love it with mayo that is all...",0
at least make sure she is not hurt bitches,0
"Nope, not alone. And some are just ok in appearance, but there's this sort of thing to them, you know they'll be hot in the sack. I don't mean the sluttiness, I mean the... hawt? Whatever.",0
[USER] because I grabbed her by the pussy,1
"Typical entitled female bullshit. Everyday people can believe whatever they want. But they cannot exact a punishment on someone who is an alleged transgressor, unless they have proof that the crime as reported is not exaggerated or over-reported.",1
Very smart. Incels keep saying all girls are feminist manipulative whores but they still dream of relationships with them.,0
Perhaps a page should be taken out of the Klinton/Obamaha playbook and punch back twice as hard; destroy her privacy completely.,4
"Bad for girls - these strategies do not create attraction, but it is fantastic advice when applied to other men. Buy it today. [[URL]",0
"The women with patreons are functioning as virtual strippers, they waste time and funnel money that could be donated to a number of more substantial things than signed calendars and private snap chats",1
"Never forget, it's always the man's fault. Never her fault for running off with a boy who gives her the tingles to go fuck in a shack in the woods behind the football field or her shitty parents not instilling any discipline in her whatsoever.",3
"And it is women who are terrified of men controlling their sexuality, because men wanting to fuck women is literally the only reason women survive.",1
LMAO I would beat this little shit up and fuck his mom,1
The gun community keeps supporting “free market capitalism” like a woman returning to her abusive husband.,0
"She’s a whore just desperate to get her name mentioned on air, just like Maxine Waters. Before Trump, who even knew Mad Max was in Congress ?",1
"ugly, miserable, vindictive skanks that fail at being a woman. (i'm a girl and i despise these feminist cunts) they are a plague.",1
"This sub TOTALLY slut shames ALL THE TIME! Incels LOVE to blame women for sleeping around with people, but then somehow see that perceived sluttiness as the reason they can't get laid.",0
Women become corrupt then they come to the USA. All the women that I know of my race have turned to tall white looking people when they came to this country,1
If you want to attack culture and norms you have to go after the women themselves and call them out on their shit.,3
"No matter how ugly, any women can get laid no matter what",0
"Of course it was. Is there nothing that can't be blamed on women or feminists? I mean, I know whenever celibate men who talk about an imaginary sky-fairy for a living lobby our federal government to do something, I'm always like, ""DAMN BITCHES.""",1
A group of sour old millionaire women paid to continually bitch about their oppression. I'm sure their lives are difficult.,0
The ignorant Oprah bitch thought she was of Zulu ancestry or some such - they did a DNA test on her and she was west African coast like 99% of African-Americans brought here as slaves.,0
"Holy shit, I'm so happy to be 6'2. Manletism is worse than cancer. I feel so bad for my manlet bros Fuck women and their retarded standards",1
So is she admitting that women are less mature than men?,1
"She could lose track of her drink, then tip it out rather than drink it. But I was trying to adjust the example so that the woman's behaviour affects the rapist.",3
"AWALT. The guy had social status, so she attached to it instantly.",1
"So she’s not just a whore, but a lying whore? Got it. 🙄 [URL]",1
"He's talking about his heart for the #illegalaliens that have invaded our country, are dealing drugs, raping our women and children and murdering our citizens. I was on to him when he selected #amnesty boy #PussyPence.",0
female egg donors are allowed to be uggo as fuck but male sperm donors have to be models.,1
the worst thing is that those dudes sometimes ruin the girl and a bad experience will turn her into a slut like every other girl,1
"Not so fast there, chief. Any time a woman spouts a nonsense statistic like that you can rest assured that she is including herself in the 85% that has done no wrong. That 15% is made up of nameless, faceless women whom no other woman has ever met.",1
"I'm not saying he should have killed her, but I understand.",4
"Clearly I meant both. I'd rather regularly fuck a 7 that's fun to chill with than a 9 that makes me question reality and stresses me tf out. That's why the quote goes ""For every hot chick out there, there's a dude who's tired of fucking her.""",1
"""A New Zealand dumb cunt that lives in own reality offering nothing but pics of her small tits and no ass does not acknowledge the tragedy that happened in her own country""",1
"I have a newfound respect for Secretary Chao, she's a true ride or die bitch!",0
Lol at the normies on this who don't realize that women of any race all find us subhuman. Cut the optimistic bullshit.😂,1
"[USER] Let's play this song and trigger the feminists, male and female, who (having no ideas) claim it's a song about ""rape."" Idiots.",3
I couldn't give a fuck what women want,1
"Hey ladies, don't be stupid. Follow Lauren Southern's lead. She's smart, pretty and woke AF. Good combo. [URL]",0
This whole comic confirms the blackpill God I fucking hate females they make me wanna die why the fuck can't they just vanish off the face of the earth,1
"Lol guys, I seen the original, it's posted by a mum xD even the mum is a whore and won't tell her daughter off.",1
I love this. Thanks for sharing. PS I usually have sex on the first date and am definitely not a whore.,0
"As a kid, I grew up in my teen years on the streets. She wouldn't have succeed in hitting more than twice before I beat the living hell out of her.",4
fuck that from now on whenever you have a spare moment just call them cunts and faggots through the reporting system,0
"That proves that the wife is a nice person. I mean, to be pregnant with puppies, one must first be a bitch.",1
