"She's still an AWALT. Doesn't matter, wife, girlfriend, hooker, stripper, gold digger, sugerbaby, camgirl, IG thot, they all get your money. I've stopped giving women my money.",1
"It all depends. But what im trying to say, girls want emotions, not some logical political debate. Spike their emotions. Say something funny, something provocative, dance with them etc",0
And if he was a male sex slave he'd bitch and whine,0
In this climate of thirsty men these women are still adopting a scarcity mentality. Lol just how unattractive are average men? They must be ugly women who only attract ugly men.,1
"Yeah, she is holding up the sign to hide her enormous hippo arse. #feminists #redpill #mgtow #feminazi",0
Wire her jaw shut...,4
They need to take this cunt out back in the ally and work her over with a 2x4. [URL],4
"So pussy, does this mean that you represent now one then? +1 (Neo) #Trump #KAG #GabFam #SpeakFreely",0
Committed relationship; accidental pregnancy; STDs. You shouldn't have to ask this question. Keeping her around after she knows that you know who she truly is essentially means she gets what she wants and you become her bitch.,0
"Fucking bitch, if society was good they would be calling out this hag for being a piece of trash.",1
Taki played a women's champ in an informal match and even he a low ranked player beat her and she was very good (and black BTW). He did not crow about it nor did the lady go on TV and spew the usual psycho babble which inflames the masses of asses.,0
If you have to listen to a woman cackle at least pick the pretty one so you can tell your friends I know she is a bitch but look how hot she is...,1
"that shit wouldn't happen if women weren't attracted to aggressive dominant men. if women stopped sexually selecting for that type of man, that type of violence would die off in a generation.",3
"Schedule a date with her, then don't show up. Then text her ""GOTCHA BITCH""",4
I don't like degenerate Jews that suck tranny penis.,0
Put a fork in Muslim-England she's done for and there is no saving it from going full Islamic Sharia Law. What a millennium for England from being the greatest empire in the world to being evil Islam's British child rapping and acid throwing bitch.,0
I'd like to fucking shoot Theresa May if it wasn't illegal! - but then she's already shot to pieces.,4
Millennials are fucked up because they were raised in daycares instead of being raised at home with their mothers.,1
"He is a complete idiot and puppet for Schumer. He wishes I was referring to the whore, Amy but I'm not. I mean Chucky, her uncle.",0
"They see but theyll say some bs like"" i know my worth"". Fds women are so sub par that even tbe 6/10 white women on my tinder mog the entre sub forum to oblivion.",1
More proof females are not good leaders,1
"Sure seems it. being as modern feminism and culture has told the women that the best way to happiness and success has to essentially become men, save for the penis, the only thing they need is one.",0
"Come on.. Even women (FOR FUCK'S SAKE..) are coming out in MSM saying the ""me too"" ""rape culture"" shit needs to get capped. This nonsense has gone too far.. When does it end?",3
That is fucking savage. He should kick her ass in school the next day.,4
"Oh and here's the best part: [[URL] She claims that she knows CPR in case a dog is choking. Bitch, YOU'RE ON CAMERA CHOKING YOUR OWN DOG BY PICKING IT UP OFF THE GROUND BY THE NECK.",0
The only thing you do wrong is fucking low value females. A higher quality female will have no problem with 100% alpha.,0
"Good point, i went on a tinder date once and the girl didn't mind not talking all the time which i found incredibly refreshing, too bad i wasn't physically attracted.",0
god please make her go away evil bitch,1
"What a total cunt. PS It's the mother who's the total cunt, not the kid.",1
FTFY: Seduction 101: women want what other women have. Simple as that. Sounds better that way.,0
Sounds like the only sensible thing to do is don't let Male or female brown people ever see or get near white women. The female is going to get insanely jealous and the Male is going to try to rape her... Not a good situation.,0
"If you're accused, you're guilty AND if the woman ""victim"" says you're innocent, then she must be delusional: Matt Boermeester, USC kicker, removed despite girlfriend’s denial of abuse [URL]",3
"I am a 17yo. This is how it is perceived by us. 18-19 Senior girl dating college boy OK Senior girl dating post college working man -> creepy man, whore girl.",0
Average man works 8 hours more thats a full day extra than the average woman and even after decades and study after study they refuse to accept thats the main reason. Because that does not fit their narative.,3
"Lol no, he has no tumblr hoes fangirling for him and something you’ve failed to realise is that his face was actually really ugly.. only women can see it",1
I don't see the appeal of it either which is why I don't think I'll ever buy one. But it comes with a lot less baggage than a real woman at a fraction of the price.,1
Just reversed HALO affect. Yeah yeah stacies nice ugly girls bitch. Not even close.,1
Sounds like she’s not loyal to her boyfriend / most likely a slut so you should’ve fucked her that night. Rookie mistake!,1
I am so sick of this pay gap bullshit. What about the hire gap? If you are up against a woman for a job kiss your chances goodbye. She will get hired 90% of the time.,3
Just convert to Islam and shout Allahu Akbar before you assault woman from now on. If your a muzzie they will literally give you a medal and they keys to the city when you throw acid in a whores face.,4
"Having some fucking roasties trying to trick me in highschool, pretending they liked me and always talking to me and shit. All lies and tricks. Made my blood boil when I found out. Never looked at women the same way again.",1
"Ah, I see. How dares a girl play a game, games are for boys. Lol.",0
"Depends on where you are, generally by military the bases they will, but away from them it's very hard. You shouldn't need prostitutes in Japan, the women are very easy to pick up if you know how.",0
She is a loon Putin should turn up at number 10 and give her a wee slap,4
You first ask a female do define male privalage before bombarding her with facts. You can easily debunk anything a feminist claims. Same goes when asking her to justify feminism or female rights.,3
"youre never gonna have your dream car, your dream job, your dream house, or your dream girl be happy with the house, car, job, and pussy that you have &#x200B; thats how",1
Islam is always right about these disgusting creatures.please my mgtow friends islam is the key and woman should be under sharia immediately,1
"you know who i hate more than women? Those bitch ass feminist soyboys, they should be gassed",1
Western women are truly the most entitled people to have ever lived on this earth,3
That’s because every thot and semi confident 18-21 yo thinks they can sell their beauty. Problem is the market is flooded with soooo many. They have to compete and prices are getting lower.,1
"Nicola Sturgeon, like Merkel, like May, like Rudd...all traitors, all in need of rope and lampposts. If this young girl were mine, blood would be spilt, and that blood would be the blood of traitors.",4
"Who's cock is she sucking? If it's not yours she is not interested, period.",1
"There's a reason for gender roles. Men don't lust over butch girls, and women don't want soft, metrosexual hipsters. I totally agree.",0
Women are the procurers. The Moors Murders in the UK stand alone as the worst crimes ever committed on British soil in modern times. The woman lured the children. Their fate has gone down in history as the worst of all possible crimes.,1
"At least she is 1000x times more durable than any woman out there, while being sure she wont charge you with false-rape accusations. Not to mention that she wont deny you sex whenever you want as well.",1
"I was unaware that was you, thicc isn’t my type but I don’t disregard men who prefer it. This is thicc tho, not some fatass who insists her rolls is what makes her thicc. That’s what I was trying to say.",1
I'm beginning to see why women weren't allowed in politics or allowed to vote.,3
I understood that. My post had to do with the idiot that said all women are feminists. Strong women and feminists are not the same. In fact I'd venture to say that a feminist is a weak woman pretending to be strong.,1
"[URL] This is the reason why i am wary of Thots and I'll look til i find a Tradwife, they just simplify everything.",0
Excuse me if I don’t believe they will actually serve the full sentence. I’m still waiting for some Hail Mary Pussy Pass. Or once she’s in the sentence will be cut to maybe 2-3 years for good behavior.,0
Can't stand whores that break up relationships. Good for her!,0
Sadly most women love themselves a good slave....and most men oblige and submit out of weakness.,0
"Every girl in a game, or on sites like twitch or youtube have a following of tons of thirsty dudes, all because they are female.",0
We should be blaming the young women entrapping an older man so she can get his money. These whores are just mad that they did not get the money.,1
If fat acceptance worked both ways with both sexes then great....but it's always a pic of a fat woman being lusted over by a fit guy.,0
"[USER] Chocolate is a real bitch. You can yell n scream all you want, chocolate gives no fucks! ...and she has mean deplorable friends too. #GabChefs",0
"The arrogance of this bitch too as if a bitch has any idea what's good for a society or men. Narcissist level 10,000",1
"That bitch is on point, and working to ensure her meal ticket with a betabux in case things don't work out for her with Chad.",1
Not our fault she chose to date an abusive scumbag. 💀,3
"only men with balls will survive jewish persecution from now on, cowards will die like women ♫ [URL]",1
Go figger. I had my 3rd in 4 months and it was permanent. Just for calling a cunt a cunt.,0
You bitch ass betamale who's trying to cope by telling yourself that the reason women do not want to fuck you is because women don't like sex. Whatever helps you sleep at night.,0
"I wonder if a stacy and a chad marry eachother, is she still a whore because she didn't marry ane incel?",1
"Find the g spot, get her off multiple times with your fingers first. Then she will be primed to get off from penetration, it won't matter much how good/bad your dick game is.",0
"Nope, just the typical American woman. LOL",1
Then they just turn into trad thots,0
Her problems with being a slut doesn't stem from morality but because chicks like that accumulate damage. But it's like an opportunity thing.,1
"multiple women married to one dude how's that different from ""wife""? And, yeah if she had 20 dicks in her, she's a lost cause. Virgin is a must.",1
well most people are idiots so woman are idiots more then avarage. and every idiot can be useful so yeah,1
Imma call animal control on her ass if i ever saw that bitch anywhere,1
"Bitches are children and need constant praise no matter how retarded they are? This is why I never compliment women. They'll probably think it's rape, and their self-esteem is *way* to high anyway.",1
"She looks like she ate every _GODDAMNED_ Philly cheesesteak she could find in Philly, the greedy hoe.",0
I shouldn't be surprised that so many white women I know are childless. They've been fed this sort of #NoRepro propaganda all their lives. #NoRepro is #NoEuro.,0
"Rot in hell bitch. You are a disgrace to aunties, moms, and law abiding US citizens. You deserve to lose all that you’ve “gained” from your corrupt political practices.",0
[USER] When I heard about this -- I honestly thought she was bitching out the IT guy for #Hillary ... all that double and triple withdrawing of donations...,0
I don't know what is more pathetic between a cunt and her simps.,0
Us old fuckers will shoot you wetback cunts by the thousands. No mercy. You and your families.,0
"I'd love to see the underlying data sets. And reanalyze them. Could probably see some juicy clusters quantifying female divorce rape of men. Until then, I guess [URL] will have to do.",3
Yes. But the right (liberal) women will be the ones dying. We're OK with that.,4
No need to feel like a pussy idk what neck beard has to do with it? Maybe its a reddit thing I don't know about. But don't compromise your values. You should be proud,0
"Exactly. Everything you wrote is true. The more successful you are as a short man, the more insecure many women choose to see you, they just see you as pathetically trying to make up for being short.",1
she had an extremely sensitive ex boyfriend that made her go through hell Says every woman ever You need to either hard next or step up the dread game in a hurry,0
"If ya want women to carry, tell them to turn on c-span...",0
The dating situation for black women is extremely pitiful. I actually feel bad for the smarter ones.,1
"male-dominated major (no single female friends around) None of this matters when it comes to women though. Online dating, daygame, nightgame.",0
"She most likely just wanted *something* to bitch about wrt your fridge, so that was her response. Apples and string cheese are completely legit to have on hand",0
"Here's to gunpowder and pussy, Live by one, die by the other Love the smell of both!",0
"Maybe part of the reason you're not successful with hotter women is a lack of experience, and easier game can help you work on your approach, and your close, until you come across as the suave motherfucker you want to be. Training wheels.",0
"True. But in either case, I'd take it off in most settings because a thot's radar to those shiny things is almost undetectable, unrelenting and infallible.",0
"That was an incredibly depressing episode, men don't red pill men, women red pill men.",0
"DO it. First she lies about this, than a rape or an assault in the future and ruins an innocent's life. Make that women regret ever taking a stance and fuck her until she screams. Then some more.",4
Fucking vermin!!! Sick bastards!! But this chick should have never gone to a room with a stranger alone!! 😔 Poor girl!!,3
Women think men want disposable sluts. That's what they've been led to believe and so that's what they're giving us. I'm saying that we need to send a strong message that we want wives.,0
your girlfriend was a crack whore but you did none RIGHT!! 🤔,0
It's okay to disrespect women on the right. Don't expect people to respect you if you don't even respect yourself. Wearing a strap-on in public for her teenage fans was hardly her respecting herself.,4
"Cynical = fucked by chad too many times ,and now she is sad ,because chad wont fuck her",1
What I got from that is only if you’re male and not if you’re with women. Femoids are a hivemind. If you’re with a woman your value increases,1
Sugar and Spice and women are never nice.,1
"NetFlix ""allowed"" this vicious c*** to broadcast celebrating Independence Day w her ""Salute to Abortion"". It has caused other countries to address the Liberal Lunacy of The USA. Another Embarrassment for our country, The United States of America. *",1
nofap is a horrible thing which un-makes a man and turns him into either a pussy-thirsty chump or into a sexless asexual without purpose in life.,0
"Apparently, in Ancient Rome men started fucking eachother a fair bit because the women were too retarded to hold decent conversations and fulfill their intimate needs due to lacking education",1
Jup. Have you ever seen mothers pimping their daughters. Horrible whores. A friend of mine was loaded (his dad was). We went on vacation in Egypt and man did these whores try to get his nuts. He was like 15 at the time. Pathetic.,1
True. Genocide is more effective and honestly I’m a sick bitch and would love to kill off weak whites along with the fags spics niggers and kikes,0
"Yh she is a slut, well she said she had a bf for 5 years and then a slutty phase afterwards. But i believe her for the most part bc she is fairly tame tbh, ive met girls who were a lot more slutty & manipulatice than she is",1
Or because she could just say she was raped and everybody would believe her.,3
"Two women were mean to a fictional man within my hearing range, that's why they all deserve to be sex slaves.",4
"This woman was being a bitchy cunt, and he responded in kind. That makes him a misogynist? Or was it the standing up for himself that makes him a misogynist? Or maybe it was the fact that *he* decided that *she* wasn't worth it?",1
He should have used underage british girls instead of prostitutes,4
Lmao even if you were still fat and lacking style you'd still have more success than an incel could ever dream of simply because you are a woman,3
Not guilty by reason of he had enough of that annoying bitch.,0
"government took away all male authority in the home, its all female by default.",3
Don’t hate women I just understand the price that is paid being with them (not sex) and it’s not worth it...AT ALL.,1
"Never listen to a what a woman says.. Watch what she does Also, if a women figures they can't control you, they don't want you.. They are very subtle and insidious control freaks. Gyow",1
This disgusting disease suckin baby eating jewish olive oil whore fuck pig is an asshole. Fuck her too,1
"ah, those are actresses speaking words written for them -- with the exception of diller who said she wrote 75% of her act -- without men writing for them, they're not funny. case in point: roseanne. can't act and can't write.",1
The only shocking thing is that she admitted it. Most women will go to their graves never speaking a word of truth,1
She's probably just a bitch. Believe it or not it's not always us. Some females just wanna watch the world burn,1
Behind every successful man there is a successful woman. Successful in finding him.,0
The women play better than the men? I remember when it made national news that someone in the WNBA dunked the ball. Almost everyone in the NBA can dunk.,1
Gotta make sure to get that wine glass in the shot. And the TV. And the door. Fucking vapid cunt. I'm so happy for her ex - I truly hope he takes his red pills and finds peace and solitude.,0
"Read this. The author may not realize it, but she demonstrates quite clearly the need for #WhiteSharia. At this point, only the contemptuous pimp-slap of the patriarchy can save white women from themselves.",1
fuck that Roaming Millennial that stupid bitch shoudn't have interview Richard Spencer at first place. stupid birical girl should check self . she is racist to Asian. she cry for white racism. I think white passing hapa tend be dangerous it .,1
"Unlike women, this car doesn't drive you crazy.",1
"Plus it's easy to be a slut. Tinder, be a woman. Bars, be a woman. All she has to do is say yes. A man? Be rich, good looking, successful, interesting. Top 1% of men can do this. And there's work involved.",0
or.... you could just not be a puss and rub her clit,0
Umm what? What percentage of women do you think are cam whores? This is a bizarre claim. I'm guessing youre just way into cam whores.,0
Another proof if that was necessary of the fact that femi Nazi is Anti Male and Anti Freedom. it's a pure female supremacy goal and a sheer Hate group !,1
"And the women probably have zero issue with finger-fucking their phones on Instagram/Tindr/facebook, ~~flirting~~ chatting with Chads all day. That's basically the female equivalent to pornhub.",1
Jackie Kennedy > Marlyn Monroe. Style and finesse trumps blonde bombshells any day of the week. #SpeakFreely,0
I told a feminist in one of my classes that I would only support feminism (fucking never!) when feminism gets behind tying womens right to vote with the draft. She got super triggered and started yelling at me. it was hilarious.,3
The only thing more gay than sucking a penis is going down on a woman. Why would someone degrade themselves like that?,1
Good..Means she will bleed to death..,4
imagine thinking chad gays have lower standards than women,1
The best girls come when you aren't looking for one. Desperation will take you nowhere. It's worth building an emotional connection with someone as opposed to finding a pussy to bang. That's been my experience at least.,0
But what he said towards the end in the car about the Jewish witch was spot on and I think I broke a rib laughing so much.,1
"Dude, it took me 10 minutes to figure out these were before and after pics. At first I didn't believe that most women hit the wall hard at 30. This was a really fucking mind opener",1
[USER] #Breitbart comments poetry: There was an Italian putana she'd do whatever you wanna the agreement was oral though highly immoral yet more honest than Madonna. #MAGA #GabFab #Italy #Referendum #OralContract,1
Ask her what her vagina size is.,1
Adding insult to injury the women had cucked him with another man and tried to hide it from him. Poor guys going to have to deal with this bitch for the rest of his life now.,1
If you have ANY physical flaws in 2018 as a male then it's fucking over. [Meanwhile there are pig women getting offers from dating sites every single day.] ([URL],1
"Because women want to have FULL CONTROL over you, from the friends you have, to the job you work, to even having the choice to satisfy yourself. Its why i'll never get married, even if the laws were changed...",1
"[USER] Don't they already have enough victim cards? I'd have though every single western woman would be holding a royal flush by now. Oh well, I suppose an extra ace up the sleeve may come in handy.",3
"That's because black women are more overweight, less feminine, and bitchier on average",1
"On the other hand if she doesnt fuck you on the first date then either shes using you, or shes not into you.",1
"No men in the ladies restroom! Women are the majority in the US, 51%, why should our privacy and safety be compromised for a confused 1.2% of the population.",1
Fucking disgusting you can see the kid trying to hold on single motherhood is a plague avoid that shit AT ALL COST,1
"You don't ""communicate"" being an alpha. You need to become an alpha. Women pick up on that far better than you can imagine.",0
"Unfortunately, we know some men are ready to spend that kind of money for a masculine, ugly looking hoe with a sense of entitlement up to the roof. Let's contribute to this person education and tell her to fuck off.",1
Fucking inbred cunt bet your mother is your aunt,0
"I notice the same, lifting really increases overt interest from gay guys but any IOIs from girls are still rare. I think with girls you have to have elite looks to get IOIs barring some exceptional circumstance.",0
"Evidence of ""rape culture"" is like evidence of aliens visiting earth. There are secret hints here and there, so you just have too stare at it long enough to see what you want to see.",3
Why the fuck would you go for crazy bitches?,0
Can almost guarantee she'll be sitting in HR's office in no time saying you were harassing her or some other. NEVER discuss or say anything to a woman in the workplace that isn't directly related to work.,3
"That's the common mistake men do. I saw many of my friends falling to the same life, even those that kept being in a relationship are miserable with a fat wife they are not attracted to because she's fatter than he is.",1
Report the cunt to the bar,0
"once again i just hear womens groups say"" women are not responsible enough to make a choice"". fine womens gropus here's what we'll do: revoke your rights to sex. you can only have sex if men preaprove it. sounds good right?",3
"Come to think of it (see what I did there?) . . . In my experience, an Awful lot of women who are in dire need of an IQ upgrade seem to be trying this out.",0
The women are always the craziest.,1
Reminds me of the time those thots built that bridge...That collapsed in Florida.,0
Who would sexually assault this woman? Is it a necrophiliac?,1
"yes cunt.. yu think i was dumb did you a@ learn how i know why youve such bot problem....cos i got mine own that spit out troll idenitites matching em to real folk. you seem to have mastered fucking off though , so all credit to you,",0
"Ya. Guess where she is now? Dead. RIP, crazy Cathylick bitch. Mutey time, DJ nigga. :)",0
I think men everywhere are starting to get tired of the shitty female attitude. The only ones that are keeping this going are the white knight simps and the cuckoo who are married.,1
WTF???? They must be good gals and conservatives as they are pretty and have nice tits!!!!! LOL,0
"A smart person can predict the future, a dumbass can only see the short term benefits. \#metoo, feminism, black lives matter, nazi's, socialism, Marxists, etc all fall in the same category. It's all leftist bullshit.",3
4 hours go by without a supportive tweet on Twitter and drama queen and attention whore [USER] reactivates right on schedule,1
"Social media is to women, what porn is to men.",0
"It was basically, just marry the incels to post-cock carousel riders and transform them into real slave cucks. They will still get no sex, and will have to pay for the wife shit.",1
Wait until his wife makes a rape allegation against him because she found some other man and wants to leave him. This is what happened to me when I caught my ex wife cheating,1
Not until they get rid of that dead glassy stare. Too much like real women.,1
"(most ethnic women - all indian women - are unattractive) ROFL. clueless. not all, just most",1
I've been doing this since day 1. At 6'4 Slipping two fingers between chadlets girlfriends legs in the club and turn around to her knowing he has to take it. It makes it all worth it.,1
